{
  "id": "fulacin",
  "name": "Fulacin",
  "sector": "Spinward Marches",
  "subsector": "H",
  "hex": "2613",
  "uwp": "A674210-D",
  "tradeCodes": [
    "Lo",
    "An",
    "Ht"
  ],
  "allegiance": "Im",
  "bases": [],
  "stellar": {
    "primary": "G2 V",
    "type": "Single"
  },
  "worlds": 10,
  "gasGiants": 2,
  "planetoidBelts": 0,
  "notes": "Excellent starport. TL13.",
  "wikiUrl": "https://wiki.travellerrpg.com/Fulacin_(world)",
  "celestialObjects": [
    {
      "id": "fulacin-star",
      "name": "Fulacin Primary",
      "type": "Star",
      "orbitAU": 0,
      "bearing": 0,
      "radiusKm": 696340,
      "stellarClass": "G2 V",
      "stellarInfo": {
        "temperature": "5,200-6,000 K",
        "luminosity": "0.6-1.5 Solar",
        "mass": "0.8-1.04 Solar",
        "habitableZone": "0.8-1.2 AU",
        "description": "Yellow main sequence (Sol-like)"
      },
      "transponder": "NONE",
      "gmNotes": "G2 V primary.",
      "cameraSettings": {
        "zoomMultiplier": 0.15,
        "offsetX": 0.25,
        "offsetY": 0.1,
        "description": "Wide corona view with inner system visible"
      }
    },
    {
      "id": "fulacin-mainworld",
      "name": "Fulacin",
      "type": "Planet",
      "orbitAU": 1.0620201315750335,
      "bearing": 48,
      "radiusKm": 5600,
      "uwp": "A674210-D",
      "atmosphere": "Standard Tainted",
      "breathable": true,
      "inGoldilocks": true,
      "transponder": "FULACIN CONTROL",
      "gmNotes": "Mainworld. Pop 10^2. TL13.",
      "cameraSettings": {
        "zoomMultiplier": 0.8,
        "offsetX": 0,
        "offsetY": 0,
        "description": "Standard world view"
      }
    },
    {
      "id": "fulacin-highport",
      "name": "Fulacin Highport",
      "type": "Highport",
      "parent": "fulacin-mainworld",
      "orbitKm": 400,
      "bearing": 268,
      "radiusKm": 2,
      "transponder": "FULACIN HIGHPORT",
      "gmNotes": "Class A Excellent starport orbital facility.",
      "celestial": false,
      "cameraSettings": {
        "zoomMultiplier": 1,
        "offsetX": 0,
        "offsetY": 0,
        "description": "Station approach"
      }
    },
    {
      "id": "fulacin-gasgiant",
      "name": "Fulacin Gas Giant",
      "type": "Gas Giant",
      "orbitAU": 7.370602474650678,
      "bearing": 165,
      "radiusKm": 51867.97299284649,
      "transponder": "NONE",
      "gmNotes": "Gas giant suitable for fuel skimming.",
      "cameraSettings": {
        "zoomMultiplier": 0.5,
        "offsetX": 0,
        "offsetY": 0,
        "description": "Gas giant view"
      }
    }
  ],
  "locations": {
    "default": "fulacin-mainworld",
    "starport": "fulacin-highport",
    "orbit": "fulacin-mainworld"
  }
}