{
  "id": "494-908",
  "name": "494-908",
  "sector": "Spinward Marches",
  "subsector": "I",
  "hex": "0625",
  "uwp": "X893000-0",
  "tradeCodes": [
    "Ba",
    "Fo",
    "Re",
    "Lt"
  ],
  "allegiance": "Im",
  "bases": [],
  "stellar": {
    "primary": "G2 V",
    "type": "Single"
  },
  "worlds": 6,
  "gasGiants": 0,
  "planetoidBelts": 1,
  "notes": "None starport. TL0.",
  "wikiUrl": "https://wiki.travellerrpg.com/494-908_(world)",
  "celestialObjects": [
    {
      "id": "494-908-star",
      "name": "494-908 Primary",
      "type": "Star",
      "orbitAU": 0,
      "bearing": 0,
      "radiusKm": 696340,
      "stellarClass": "G2 V",
      "stellarInfo": {
        "temperature": "5,200-6,000 K",
        "luminosity": "0.6-1.5 Solar",
        "mass": "0.8-1.04 Solar",
        "habitableZone": "0.8-1.2 AU",
        "description": "Yellow main sequence (Sol-like)"
      },
      "transponder": "NONE",
      "gmNotes": "G2 V primary.",
      "cameraSettings": {
        "zoomMultiplier": 0.15,
        "offsetX": 0.25,
        "offsetY": 0.1,
        "description": "Wide corona view with inner system visible"
      }
    },
    {
      "id": "494-908-mainworld",
      "name": "494-908",
      "type": "Planet",
      "orbitAU": 2.442275538322625,
      "bearing": 158,
      "radiusKm": 7200,
      "uwp": "X893000-0",
      "atmosphere": "Dense Tainted",
      "breathable": false,
      "inGoldilocks": false,
      "transponder": "494-908 CONTROL",
      "gmNotes": "Mainworld. Pop 0. TL0.",
      "cameraSettings": {
        "zoomMultiplier": 0.8,
        "offsetX": 0,
        "offsetY": 0,
        "description": "Standard world view"
      }
    }
  ],
  "locations": {
    "default": "494-908-mainworld",
    "starport": "494-908-mainworld",
    "orbit": "494-908-mainworld"
  }
}