{
  "id": "gungnir",
  "name": "Gungnir",
  "sector": "Spinward Marches",
  "subsector": "J",
  "hex": "1221",
  "uwp": "B544779-8",
  "tradeCodes": [
    "Ag",
    "Pi"
  ],
  "allegiance": "Im",
  "bases": [],
  "stellar": {
    "primary": "G2 V",
    "type": "Single"
  },
  "worlds": 8,
  "gasGiants": 1,
  "planetoidBelts": 0,
  "notes": "Good starport. TL8.",
  "wikiUrl": "https://wiki.travellerrpg.com/Gungnir_(world)",
  "celestialObjects": [
    {
      "id": "gungnir-star",
      "name": "Gungnir Primary",
      "type": "Star",
      "orbitAU": 0,
      "bearing": 0,
      "radiusKm": 696340,
      "stellarClass": "G2 V",
      "stellarInfo": {
        "temperature": "5,200-6,000 K",
        "luminosity": "0.6-1.5 Solar",
        "mass": "0.8-1.04 Solar",
        "habitableZone": "0.8-1.2 AU",
        "description": "Yellow main sequence (Sol-like)"
      },
      "transponder": "NONE",
      "gmNotes": "G2 V primary.",
      "cameraSettings": {
        "zoomMultiplier": 0.15,
        "offsetX": 0.25,
        "offsetY": 0.1,
        "description": "Wide corona view with inner system visible"
      }
    },
    {
      "id": "gungnir-mainworld",
      "name": "Gungnir",
      "type": "Planet",
      "orbitAU": 1.1583038603171545,
      "bearing": 46,
      "radiusKm": 4800,
      "uwp": "B544779-8",
      "atmosphere": "Thin Tainted",
      "breathable": false,
      "inGoldilocks": true,
      "transponder": "GUNGNIR CONTROL",
      "gmNotes": "Mainworld. Pop 10^7. TL8.",
      "cameraSettings": {
        "zoomMultiplier": 0.8,
        "offsetX": 0,
        "offsetY": 0,
        "description": "Standard world view"
      }
    },
    {
      "id": "gungnir-highport",
      "name": "Gungnir Highport",
      "type": "Highport",
      "parent": "gungnir-mainworld",
      "orbitKm": 400,
      "bearing": 268,
      "radiusKm": 2,
      "transponder": "GUNGNIR HIGHPORT",
      "gmNotes": "Class B Good starport orbital facility.",
      "celestial": false,
      "cameraSettings": {
        "zoomMultiplier": 1,
        "offsetX": 0,
        "offsetY": 0,
        "description": "Station approach"
      }
    },
    {
      "id": "gungnir-gasgiant",
      "name": "Gungnir Gas Giant",
      "type": "Gas Giant",
      "orbitAU": 5.431497716153989,
      "bearing": 70,
      "radiusKm": 65708.32222504813,
      "transponder": "NONE",
      "gmNotes": "Gas giant suitable for fuel skimming.",
      "cameraSettings": {
        "zoomMultiplier": 0.5,
        "offsetX": 0,
        "offsetY": 0,
        "description": "Gas giant view"
      }
    }
  ],
  "locations": {
    "default": "gungnir-mainworld",
    "starport": "gungnir-highport",
    "orbit": "gungnir-mainworld"
  }
}