{
  "id": "crout",
  "name": "Crout",
  "sector": "Spinward Marches",
  "subsector": "O",
  "hex": "2232",
  "uwp": "E4359CA-7",
  "tradeCodes": [
    "Hi",
    "Pz"
  ],
  "allegiance": "Im",
  "bases": [],
  "stellar": {
    "primary": "G2 V",
    "type": "Single"
  },
  "worlds": 10,
  "gasGiants": 1,
  "planetoidBelts": 0,
  "notes": "Frontier starport. TL7.",
  "wikiUrl": "https://wiki.travellerrpg.com/Crout_(world)",
  "celestialObjects": [
    {
      "id": "crout-star",
      "name": "Crout Primary",
      "type": "Star",
      "orbitAU": 0,
      "bearing": 0,
      "radiusKm": 696340,
      "stellarClass": "G2 V",
      "stellarInfo": {
        "temperature": "5,200-6,000 K",
        "luminosity": "0.6-1.5 Solar",
        "mass": "0.8-1.04 Solar",
        "habitableZone": "0.8-1.2 AU",
        "description": "Yellow main sequence (Sol-like)"
      },
      "transponder": "NONE",
      "gmNotes": "G2 V primary.",
      "cameraSettings": {
        "zoomMultiplier": 0.15,
        "offsetX": 0.25,
        "offsetY": 0.1,
        "description": "Wide corona view with inner system visible"
      }
    },
    {
      "id": "crout-mainworld",
      "name": "Crout",
      "type": "Planet",
      "orbitAU": 1.2604630443578222,
      "bearing": 222,
      "radiusKm": 4000,
      "uwp": "E4359CA-7",
      "atmosphere": "Very Thin",
      "breathable": false,
      "inGoldilocks": true,
      "transponder": "CROUT CONTROL",
      "gmNotes": "Mainworld. Pop 10^9. TL7.",
      "cameraSettings": {
        "zoomMultiplier": 0.8,
        "offsetX": 0,
        "offsetY": 0,
        "description": "Standard world view"
      }
    },
    {
      "id": "crout-gasgiant",
      "name": "Crout Gas Giant",
      "type": "Gas Giant",
      "orbitAU": 7.222754202640868,
      "bearing": 253,
      "radiusKm": 51250.96106695503,
      "transponder": "NONE",
      "gmNotes": "Gas giant suitable for fuel skimming.",
      "cameraSettings": {
        "zoomMultiplier": 0.5,
        "offsetX": 0,
        "offsetY": 0,
        "description": "Gas giant view"
      }
    }
  ],
  "locations": {
    "default": "crout-mainworld",
    "starport": "crout-mainworld",
    "orbit": "crout-mainworld"
  }
}