{
  "id": "andor",
  "name": "Andor",
  "sector": "Spinward Marches",
  "subsector": "M",
  "hex": "0236",
  "uwp": "C695735-9",
  "tradeCodes": [
    "Ag",
    "An",
    "Pi",
    "Fo"
  ],
  "allegiance": "Im",
  "bases": [],
  "stellar": {
    "primary": "G2 V",
    "type": "Single"
  },
  "worlds": 11,
  "gasGiants": 2,
  "planetoidBelts": 0,
  "notes": "Routine starport. TL9.",
  "wikiUrl": "https://wiki.travellerrpg.com/Andor_(world)",
  "celestialObjects": [
    {
      "id": "andor-star",
      "name": "Andor Primary",
      "type": "Star",
      "orbitAU": 0,
      "bearing": 0,
      "radiusKm": 696340,
      "stellarClass": "G2 V",
      "stellarInfo": {
        "temperature": "5,200-6,000 K",
        "luminosity": "0.6-1.5 Solar",
        "mass": "0.8-1.04 Solar",
        "habitableZone": "0.8-1.2 AU",
        "description": "Yellow main sequence (Sol-like)"
      },
      "transponder": "NONE",
      "gmNotes": "G2 V primary.",
      "cameraSettings": {
        "zoomMultiplier": 0.15,
        "offsetX": 0.25,
        "offsetY": 0.1,
        "description": "Wide corona view with inner system visible"
      }
    },
    {
      "id": "andor-mainworld",
      "name": "Andor",
      "type": "Planet",
      "orbitAU": 1.5559938555568928,
      "bearing": 65,
      "radiusKm": 5600,
      "uwp": "C695735-9",
      "atmosphere": "Dense Tainted",
      "breathable": false,
      "inGoldilocks": false,
      "transponder": "ANDOR CONTROL",
      "gmNotes": "Mainworld. Pop 10^7. TL9.",
      "cameraSettings": {
        "zoomMultiplier": 0.8,
        "offsetX": 0,
        "offsetY": 0,
        "description": "Standard world view"
      }
    },
    {
      "id": "andor-gasgiant",
      "name": "Andor Gas Giant",
      "type": "Gas Giant",
      "orbitAU": 6.494023456833629,
      "bearing": 0,
      "radiusKm": 69920.46238747613,
      "transponder": "NONE",
      "gmNotes": "Gas giant suitable for fuel skimming.",
      "cameraSettings": {
        "zoomMultiplier": 0.5,
        "offsetX": 0,
        "offsetY": 0,
        "description": "Gas giant view"
      }
    }
  ],
  "locations": {
    "default": "andor-mainworld",
    "starport": "andor-mainworld",
    "orbit": "andor-mainworld"
  }
}