{
  "id": "faisal",
  "name": "Faisal",
  "sector": "Spinward Marches",
  "subsector": "E",
  "hex": "0518",
  "uwp": "D545436-5",
  "tradeCodes": [
    "Ni",
    "Pa",
    "Lt"
  ],
  "allegiance": "Im",
  "bases": [],
  "stellar": {
    "primary": "G2 V",
    "type": "Single"
  },
  "worlds": 12,
  "gasGiants": 1,
  "planetoidBelts": 1,
  "notes": "Poor starport. TL5.",
  "wikiUrl": "https://wiki.travellerrpg.com/Faisal_(world)",
  "celestialObjects": [
    {
      "id": "faisal-star",
      "name": "Faisal Primary",
      "type": "Star",
      "orbitAU": 0,
      "bearing": 0,
      "radiusKm": 696340,
      "stellarClass": "G2 V",
      "stellarInfo": {
        "temperature": "5,200-6,000 K",
        "luminosity": "0.6-1.5 Solar",
        "mass": "0.8-1.04 Solar",
        "habitableZone": "0.8-1.2 AU",
        "description": "Yellow main sequence (Sol-like)"
      },
      "transponder": "NONE",
      "gmNotes": "G2 V primary.",
      "cameraSettings": {
        "zoomMultiplier": 0.15,
        "offsetX": 0.25,
        "offsetY": 0.1,
        "description": "Wide corona view with inner system visible"
      }
    },
    {
      "id": "faisal-mainworld",
      "name": "Faisal",
      "type": "Planet",
      "orbitAU": 1.2141442615835119,
      "bearing": 333,
      "radiusKm": 4800,
      "uwp": "D545436-5",
      "atmosphere": "Thin Tainted",
      "breathable": false,
      "inGoldilocks": true,
      "transponder": "FAISAL CONTROL",
      "gmNotes": "Mainworld. Pop 10^4. TL5.",
      "cameraSettings": {
        "zoomMultiplier": 0.8,
        "offsetX": 0,
        "offsetY": 0,
        "description": "Standard world view"
      }
    },
    {
      "id": "faisal-gasgiant",
      "name": "Faisal Gas Giant",
      "type": "Gas Giant",
      "orbitAU": 5.294798486155537,
      "bearing": 353,
      "radiusKm": 54727.91640661174,
      "transponder": "NONE",
      "gmNotes": "Gas giant suitable for fuel skimming.",
      "cameraSettings": {
        "zoomMultiplier": 0.5,
        "offsetX": 0,
        "offsetY": 0,
        "description": "Gas giant view"
      }
    }
  ],
  "locations": {
    "default": "faisal-mainworld",
    "starport": "faisal-mainworld",
    "orbit": "faisal-mainworld"
  }
}