{
  "id": "tsarina",
  "name": "Tsarina",
  "sector": "Spinward Marches",
  "subsector": "O",
  "hex": "2236",
  "uwp": "D420636-7",
  "tradeCodes": [
    "De",
    "He",
    "Na",
    "Ni",
    "Po"
  ],
  "allegiance": "Im",
  "bases": [],
  "stellar": {
    "primary": "G2 V",
    "type": "Single"
  },
  "worlds": 8,
  "gasGiants": 1,
  "planetoidBelts": 1,
  "notes": "Poor starport. TL7.",
  "wikiUrl": "https://wiki.travellerrpg.com/Tsarina_(world)",
  "celestialObjects": [
    {
      "id": "tsarina-star",
      "name": "Tsarina Primary",
      "type": "Star",
      "orbitAU": 0,
      "bearing": 0,
      "radiusKm": 696340,
      "stellarClass": "G2 V",
      "stellarInfo": {
        "temperature": "5,200-6,000 K",
        "luminosity": "0.6-1.5 Solar",
        "mass": "0.8-1.04 Solar",
        "habitableZone": "0.8-1.2 AU",
        "description": "Yellow main sequence (Sol-like)"
      },
      "transponder": "NONE",
      "gmNotes": "G2 V primary.",
      "cameraSettings": {
        "zoomMultiplier": 0.15,
        "offsetX": 0.25,
        "offsetY": 0.1,
        "description": "Wide corona view with inner system visible"
      }
    },
    {
      "id": "tsarina-mainworld",
      "name": "Tsarina",
      "type": "Planet",
      "orbitAU": 0.6316220794040086,
      "bearing": 324,
      "radiusKm": 4000,
      "uwp": "D420636-7",
      "atmosphere": "Very Thin Tainted",
      "breathable": false,
      "inGoldilocks": false,
      "transponder": "TSARINA CONTROL",
      "gmNotes": "Mainworld. Pop 10^6. TL7.",
      "cameraSettings": {
        "zoomMultiplier": 0.8,
        "offsetX": 0,
        "offsetY": 0,
        "description": "Standard world view"
      }
    },
    {
      "id": "tsarina-gasgiant",
      "name": "Tsarina Gas Giant",
      "type": "Gas Giant",
      "orbitAU": 6.23643652434723,
      "bearing": 226,
      "radiusKm": 52293.27639520388,
      "transponder": "NONE",
      "gmNotes": "Gas giant suitable for fuel skimming.",
      "cameraSettings": {
        "zoomMultiplier": 0.5,
        "offsetX": 0,
        "offsetY": 0,
        "description": "Gas giant view"
      }
    }
  ],
  "locations": {
    "default": "tsarina-mainworld",
    "starport": "tsarina-mainworld",
    "orbit": "tsarina-mainworld"
  }
}