{
  "id": "chwistyoch",
  "name": "Chwistyoch",
  "sector": "Spinward Marches",
  "subsector": "B",
  "hex": "0904",
  "uwp": "B766766-A",
  "tradeCodes": [
    "Ag",
    "Ga",
    "Ri",
    "Mr"
  ],
  "allegiance": "Im",
  "bases": [],
  "stellar": {
    "primary": "G2 V",
    "type": "Single"
  },
  "worlds": 9,
  "gasGiants": 2,
  "planetoidBelts": 0,
  "notes": "Good starport. TL10.",
  "wikiUrl": "https://wiki.travellerrpg.com/Chwistyoch_(world)",
  "celestialObjects": [
    {
      "id": "chwistyoch-star",
      "name": "Chwistyoch Primary",
      "type": "Star",
      "orbitAU": 0,
      "bearing": 0,
      "radiusKm": 696340,
      "stellarClass": "G2 V",
      "stellarInfo": {
        "temperature": "5,200-6,000 K",
        "luminosity": "0.6-1.5 Solar",
        "mass": "0.8-1.04 Solar",
        "habitableZone": "0.8-1.2 AU",
        "description": "Yellow main sequence (Sol-like)"
      },
      "transponder": "NONE",
      "gmNotes": "G2 V primary.",
      "cameraSettings": {
        "zoomMultiplier": 0.15,
        "offsetX": 0.25,
        "offsetY": 0.1,
        "description": "Wide corona view with inner system visible"
      }
    },
    {
      "id": "chwistyoch-mainworld",
      "name": "Chwistyoch",
      "type": "Planet",
      "orbitAU": 0.9906773097560002,
      "bearing": 54,
      "radiusKm": 6400,
      "uwp": "B766766-A",
      "atmosphere": "Standard",
      "breathable": true,
      "inGoldilocks": true,
      "transponder": "CHWISTYOCH CONTROL",
      "gmNotes": "Mainworld. Pop 10^7. TL10.",
      "cameraSettings": {
        "zoomMultiplier": 0.8,
        "offsetX": 0,
        "offsetY": 0,
        "description": "Standard world view"
      }
    },
    {
      "id": "chwistyoch-highport",
      "name": "Chwistyoch Highport",
      "type": "Highport",
      "parent": "chwistyoch-mainworld",
      "orbitKm": 400,
      "bearing": 268,
      "radiusKm": 2,
      "transponder": "CHWISTYOCH HIGHPORT",
      "gmNotes": "Class B Good starport orbital facility.",
      "celestial": false,
      "cameraSettings": {
        "zoomMultiplier": 1,
        "offsetX": 0,
        "offsetY": 0,
        "description": "Station approach"
      }
    },
    {
      "id": "chwistyoch-gasgiant",
      "name": "Chwistyoch Gas Giant",
      "type": "Gas Giant",
      "orbitAU": 5.781274216564637,
      "bearing": 231,
      "radiusKm": 60956.8081240139,
      "transponder": "NONE",
      "gmNotes": "Gas giant suitable for fuel skimming.",
      "cameraSettings": {
        "zoomMultiplier": 0.5,
        "offsetX": 0,
        "offsetY": 0,
        "description": "Gas giant view"
      }
    }
  ],
  "locations": {
    "default": "chwistyoch-mainworld",
    "starport": "chwistyoch-highport",
    "orbit": "chwistyoch-mainworld"
  }
}