{
  "id": "patinir",
  "name": "Patinir",
  "sector": "Spinward Marches",
  "subsector": "D",
  "hex": "3207",
  "uwp": "C000632-9",
  "tradeCodes": [
    "As",
    "Na",
    "Ni",
    "Va",
    "An"
  ],
  "allegiance": "Im",
  "bases": [],
  "stellar": {
    "primary": "G2 V",
    "type": "Single"
  },
  "worlds": 6,
  "gasGiants": 0,
  "planetoidBelts": 1,
  "notes": "Routine starport. TL9.",
  "wikiUrl": "https://wiki.travellerrpg.com/Patinir_(world)",
  "celestialObjects": [
    {
      "id": "patinir-star",
      "name": "Patinir Primary",
      "type": "Star",
      "orbitAU": 0,
      "bearing": 0,
      "radiusKm": 696340,
      "stellarClass": "G2 V",
      "stellarInfo": {
        "temperature": "5,200-6,000 K",
        "luminosity": "0.6-1.5 Solar",
        "mass": "0.8-1.04 Solar",
        "habitableZone": "0.8-1.2 AU",
        "description": "Yellow main sequence (Sol-like)"
      },
      "transponder": "NONE",
      "gmNotes": "G2 V primary.",
      "cameraSettings": {
        "zoomMultiplier": 0.15,
        "offsetX": 0.25,
        "offsetY": 0.1,
        "description": "Wide corona view with inner system visible"
      }
    },
    {
      "id": "patinir-mainworld",
      "name": "Patinir",
      "type": "Planet",
      "orbitAU": 0.6600144448858138,
      "bearing": 336,
      "radiusKm": 800,
      "uwp": "C000632-9",
      "atmosphere": "None",
      "breathable": false,
      "inGoldilocks": false,
      "transponder": "PATINIR CONTROL",
      "gmNotes": "Mainworld. Pop 10^6. TL9.",
      "cameraSettings": {
        "zoomMultiplier": 0.8,
        "offsetX": 0,
        "offsetY": 0,
        "description": "Standard world view"
      }
    }
  ],
  "locations": {
    "default": "patinir-mainworld",
    "starport": "patinir-mainworld",
    "orbit": "patinir-mainworld"
  }
}